{
  "schema_version": "0.2",
  "event_id": "example-event-001",
  "event_type": "run.started",
  "producer": "pa_harness",
  "producer_instance": "example-process",
  "sequence": 1,
  "occurred_at": "2026-09-24T00:00:00Z",
  "ingested_at": null,
  "channel": "OPERATIONAL",
  "evidence_class": "SCRIPTED_DEMO",
  "candidate_config_digest": null,
  "evaluation_config_digest": null,
  "payload_ref": "contracts/examples/scripted-event-payload.json",
  "payload_sha256": "1f10e09fab6ae08305d28e52695002485535a33620db175953f1bf2f07adadcf",
  "release_id": null,
  "run_id": null,
  "trial_id": null,
  "case_id": null,
  "slice_id": null,
  "action_id": null,
  "attempt_id": null,
  "trace_id": null,
  "span_id": null,
  "finding_id": null,
  "causation_event_id": null
}
